member_name,rank,pac_cmte_id,pac_name,connected_org,total,count
Aaron Bean,1,C00797670,AMERICAN ISRAEL PUBLIC AFFAIRS COMMITTEE POLITICAL ACTION COMMITTEE,,12692,8
Aaron Bean,2,C00563726,MR. SOUTHERN MISSOURIAN IN THE HOUSE PAC,SMITH VICTORY,10000,2
Aaron Bean,3,C00093054,WALMART INC. PAC FOR RESPONSIBLE GOVERNMENT,WALMART INC.,7500,6
Aaron Bean,4,C00234120,"UNITED STATES SUGAR CORPORATION EMPLOYEE STOCK OWNERSHIP PLAN POLITICAL ACTION COMMITTEE,","UNITED STATES SUGAR CORPORATION EMPLOYEE STOCK OWNERSHIP PLAN POLITICAL ACTION COMMITTEE,",7500,2
Aaron Bean,5,C00525063,"ALKERMES, INC. POLITICAL ACTION COMMITTEE","ALKERMES, INC.",7500,2
Aaron Bean,6,C00251876,AMGEN INC. POLITICAL ACTION COMMITTEE,AMGEN INC.,6000,3
Aaron Bean,7,C00023028,NATIONAL COTTON COUNCIL OF AMERICA COMMITTEE FOR THE ADVANCEMENT OF COTTON,NATIONAL COTTON COUNCIL OF AMERICA,6000,3
Aaron Bean,8,C00004275,AMERICAN BANKERS ASSOCIATION PAC (BANKPAC),AMERICAN BANKERS ASSOCIATION (ABA),6000,4
Aaron Bean,9,C00197228,"ELEVANCE HEALTH, INC. POLITICAL ACTION COMMITTEE (ELEVANCE HEALTH PAC)","ELEVANCE HEALTH, INC.",5500,5
Aaron Bean,10,C00451153,GRIDIRON-PAC,,5000,2
Aaron Bean,11,C00267849,ALLIED PILOTS ASSOCIATION POLITICAL ACTION COMMITTEE,,5000,2
Aaron Bean,12,C00287714,CARNIVAL/PRINCESS HOLLAND AMERICA LINE INC. PAC (HALPAC),HOLLAND AMERICA LINE INC.,5000,1
Aaron Bean,13,C00284885,THE HOME DEPOT INC. POLITICAL ACTION COMMITTEE,THE HOME DEPOT INC.,5000,1
Aaron Bean,14,C00088591,EMPLOYEES OF NORTHROP GRUMMAN CORPORATION PAC,NORTHROP GRUMMAN CORPORATION,5000,2
Aaron Bean,15,C00040998,NATIONAL AUTOMOBILE DEALERS ASSOCIATION POLITICAL ACTION COMMITTEE,NATIONAL AUTOMOBILE DEALERS ASSOCIATION,5000,1
Aaron Bean,16,C00039578,THE COUNCIL OF INSURANCE AGENTS & BROKERS POLITICAL ACTION COMMITTEE,COUNCIL OF INSURANCE AGENTS & BROKERS,5000,2
Aaron Bean,17,C00303339,"NATIONAL ASSOCIATION OF REAL ESTATE INVESTMENT TRUSTS, INC. POLITICAL ACTION COMMITTEE","NATIONAL ASSOCIATION OF REAL ESTATE INVESTMENT TRUSTS, INC.",5000,2
Aaron Bean,18,C00083535,DUKE ENERGY CORPORATION EMPLOYEE POLITICAL ACTION COMMITTEE (DUKEPAC),DUKE ENERGY CORPORATION,5000,3
Aaron Bean,19,C00147173,"WINE AND SPIRITS WHOLESALERS OF AMERICA, INC. POLITICAL ACTION COMMITTEE",WINE & SPIRITS WHOLESALERS OF AMERICA,5000,1
Aaron Bean,20,C00248716,COMCAST CORPORATION & NBCUNIVERSAL POLITICAL ACTION COMMITTEE - FEDERAL,COMCAST CORPORATION,5000,2
Adrian Smith,1,C00855296,FUEL FOR THE FUTURE PAC,,10000,2
Adrian Smith,2,C00005249,NATIONAL ASSOCIATION OF INSURANCE AND FINANCIAL ADVISORS POLITICAL ACTION COMM,NATIONAL ASSOCIATION OF INSURANCE AND FINANCIAL ADVISORS,10000,3
Adrian Smith,3,C00363879,ENTERGY CORPORATION EMPLOYEE POLITICAL ACTION COMMITTEE (ENPAC),ENTERGY CORPORATION,8000,3
Adrian Smith,4,C00197228,"ELEVANCE HEALTH, INC. POLITICAL ACTION COMMITTEE (ELEVANCE HEALTH PAC)","ELEVANCE HEALTH, INC.",7500,3
Adrian Smith,5,C00219444,NATIONAL STRUCTURED SETTLEMENTS TRADE ASSOCIATION PAC,NATIONAL STRUCTURED SETTLEMENTS TRADE ASSOCIATION,7000,2
Adrian Smith,6,C00103903,"HDR, INC. EMPLOYEE OWNERS PAC","HDR, INC.",6000,2
Adrian Smith,7,C00401687,BUNGE NORTH AMERICA INC POLITICAL ACTION COMMITTEE,,6000,2
Adrian Smith,8,C00271007,HUMANA INC. POLITICAL ACTION COMMITTEE,HUMANA INC.,5500,3
Adrian Smith,9,C00161414,PROTECTIVE LIFE CORPORATION FEDERAL POLITICAL ACTION COMMITTEE ('PROTECTPAC'),PROTECTIVE LIFE CORPORATION,5000,1
Adrian Smith,10,C00442913,BURNS AND MCDONNELL INC. PAC,"BURNS & MCDONNELL, INC.",5000,1
Adrian Smith,11,C00293910,AMERICAN ASSOCIATION OF ORTHODONTISTS POLITICAL ACTION COMMITTEE,AMERICAN ASSOCIATION OF ORTHODONTISTS,5000,1
Adrian Smith,12,C00408468,AMERICAN SOYBEAN ASSOCIATION PAC (SOYPAC),NONE,5000,3
Adrian Smith,13,C00204099,DEERE & COMPANY PAC (AKA JOHN DEERE PAC),DEERE & COMPANY,5000,2
Adrian Smith,14,C00284885,THE HOME DEPOT INC. POLITICAL ACTION COMMITTEE,THE HOME DEPOT INC.,5000,1
Adrian Smith,15,C00130773,NATIONAL MULTIFAMILY HOUSING COUNCIL AND REAL ESTATE TECHNOLOGY AND TRANSFORMATION CENTER POLITICAL ACTION COMMITTEE (NMHC PAC),NATIONAL MULTIFAMILY HOUSING COUNCIL,5000,2
Adrian Smith,16,C00448852,BARCLAYS GROUP US INC. POLITICAL ACTION COMMITTEE,"BARCLAYS GROUP US, INC.",5000,1
Adrian Smith,17,C00028787,NATIONAL CATTLEMEN'S BEEF ASSOCIATION POLITICAL ACTION COMMITTEE (NCBA-PAC),NATIONAL CATTLEMEN'S BEEF ASSOCIATION,5000,1
Adrian Smith,18,C00040279,ABBOTT LABORATORIES EMPLOYEE POLITICAL ACTION COMMITTEE,ABBOTT LABORATORIES,5000,2
Adrian Smith,19,C00303883,CASE NEW HOLLAND INDUSTRIAL INC. EXCELLENCE IN GOVERNMENT FUND (CNH INDUSTRIAL EXCELLENCE IN GOVERNMENT FUND),,5000,1
Adrian Smith,20,C00158881,NEW YORK LIFE INSURANCE COMPANY POLITICAL ACTION COMMITTEE,NEW YORK LIFE INSURANCE COMPANY,5000,2
Ben Ray Lujan,1,C00525600,OFF THE SIDELINES PAC,GILLIBRAND,10000,2
Ben Ray Lujan,2,C00743641,BLUE SENATE PAC,,10000,2
Ben Ray Lujan,3,C00629212,ALL FOR OUR COUNTRY LEADERSHIP PAC,,10000,2
Ben Ray Lujan,4,C00365270,M-PAC,,10000,2
Ben Ray Lujan,5,C00633156,I GOT YOUR BACK PAC,ROCHESTER,10000,2
Ben Ray Lujan,6,C00392738,HOOPS PAC,WYDEN,10000,4
Ben Ray Lujan,7,C00403592,NARRAGANSETT BAY PAC,,10000,2
Ben Ray Lujan,8,C00771238,DEFEND THE DREAM,,10000,4
Ben Ray Lujan,9,C00412791,FORWARD TOGETHER PAC,,10000,2
Ben Ray Lujan,10,C00416743,VICTORY NOW PAC,VAN HOLLEN,10000,2
Ben Ray Lujan,11,C00769109,HEALTH JOBS JUSTICE,,10000,2
Ben Ray Lujan,12,C00654475,SMART SOLUTIONS PAC,,10000,2
Ben Ray Lujan,13,C00424838,NOVO NORDISK INC. PAC (NOVO NORDISK PAC),,10000,2
Ben Ray Lujan,14,C00545137,LEADERSHIP OPPORTUNITY INNOVATION SERVICE PAC,FRANKEL,10000,2
Ben Ray Lujan,15,C00439992,KEYSTONE AMERICA PAC,,10000,2
Ben Ray Lujan,16,C00880062,ELECT DEMS NOW PAC,,10000,2
Ben Ray Lujan,17,C00538835,COMMON GROUND PAC,,10000,2
Ben Ray Lujan,18,C00539601,PINEAPPLE PAC,,10000,2
Ben Ray Lujan,19,C00497131,PURPOSE PAC,,10000,2
Ben Ray Lujan,20,C00497073,LOBO PAC,,10000,2
Bernie Sanders,1,C00023580,NATIONAL ASSOCIATION OF LETTER CARRIERS OF U.S.A. POLITICAL FUND (LETTER CARRIER POLITICAL FUND),BRANCH 193 NATIONAL ASSOCIATION OF LETTER CARRIERS POLITICAL ACTION COMMITTEE,-5000,1
Beth Van Duyne,1,C00411116,SPACE EXPLORATION TECHNOLOGIES CORP. PAC,SPACE EXPLORATION TECHNOLOGIES CORP.,10000,2
Beth Van Duyne,2,C00144766,NATIONAL BEER WHOLESALERS ASSOCIATION POLITICAL ACTION COMMITTEE,NATIONAL BEER WHOLESALERS ASSOCIATION,10000,3
Beth Van Duyne,3,C00369751,"DELL TECHNOLOGIES, INC. POLITICAL ACTION COMMITTEE",,10000,2
Beth Van Duyne,4,C00563726,MR. SOUTHERN MISSOURIAN IN THE HOUSE PAC,SMITH VICTORY,10000,2
Beth Van Duyne,5,C00005249,NATIONAL ASSOCIATION OF INSURANCE AND FINANCIAL ADVISORS POLITICAL ACTION COMM,NATIONAL ASSOCIATION OF INSURANCE AND FINANCIAL ADVISORS,7500,2
Beth Van Duyne,6,C00147173,"WINE AND SPIRITS WHOLESALERS OF AMERICA, INC. POLITICAL ACTION COMMITTEE",WINE & SPIRITS WHOLESALERS OF AMERICA,6541,7
Beth Van Duyne,7,C00343137,POLITICAL ACTION COMMITTEE OF THE AMERICAN ASSOCIATION OF ORTHOPAEDIC SURGEONS--PAC OF AAOS,AMERICAN ASSOCIATION OF ORTHOPAEDIC SURGEONS,6500,3
Beth Van Duyne,8,C00433060,REPUBLICAN GOVERNANCE GROUP/TUESDAY GROUP PAC,NONE,6000,4
Beth Van Duyne,9,C00447565,FINSECA PAC,,6000,2
Beth Van Duyne,10,C00255877,THE OPTIONS CLEARING CORPORATION PAC,THE OPTIONS CLEARING CORPORATION,6000,3
Beth Van Duyne,11,C00327189,VALUE IN ELECTING WOMEN POLITICAL ACTION COMMITTEE,MCMORRIS RODGERS WIN THE FUTURE FUND,5000,1
Beth Van Duyne,12,C00109546,VALERO ENERGY CORPORATION POLITICAL ACTION COMMITTEE,VALERO ENERGY CORPORATION,5000,1
Beth Van Duyne,13,C00496307,MARATHON PETROLEUM CORPORATION EMPLOYEES POLITICAL ACTION COMMITTEE (MPAC),MARATHON PETROLEUM CORPORATION,5000,1
Beth Van Duyne,14,C00196246,AMERICAN ACADEMY OF OPHTHALMOLOGY INC POLITICAL COMMITTEE (OPHTHPAC),AMERICAN ACADEMY OF OPHTHALMOLOGY,5000,1
Beth Van Duyne,15,C00379180,NATIONAL ASSOCIATION OF CHEMICAL DISTRIBUTORS RESPONSIBLE DISTRIBUTION POLITICAL ACTION COMMITTEE,NATIONAL ASSOCIATION OF CHEMICAL DISTRIBUTORS,5000,1
Beth Van Duyne,16,C00083857,OCCIDENTAL PETROLEUM CORPORATION POLITICAL ACTION COMMITTEE,,5000,1
Beth Van Duyne,17,C00084491,INTERNATIONAL FRANCHISE ASSOCIATION FRANCHISING POLITICAL ACTION COMMITTEE INC,,5000,1
Beth Van Duyne,18,C00525071,COMMERCIAL METALS COMPANY PAC (CMC PAC),COMMERCIAL METALS COMPANY,5000,1
Beth Van Duyne,19,C00089458,"NATIONAL STONE, SAND & GRAVEL ASSOCIATION ROCKPAC","NATIONAL STONE, SAND AND GRAVEL ASSOCIATION",5000,1
Beth Van Duyne,20,C00347658,AMERICAN PORTABLE DIAGNOSTIC ASSOCIATION  APDA-PAC,AMERICAN PORTABLE DIAGNOSTIC ASSOCIATION,5000,1
Bill Cassidy,1,C00027466,NRSC,YOUNG VICTORY COMMITTEE,62000,1
Bill Cassidy,2,C00797670,AMERICAN ISRAEL PUBLIC AFFAIRS COMMITTEE POLITICAL ACTION COMMITTEE,,46025,29
Bill Cassidy,3,C00363879,ENTERGY CORPORATION EMPLOYEE POLITICAL ACTION COMMITTEE (ENPAC),ENTERGY CORPORATION,20000,8
Bill Cassidy,4,C00714303,LUMEXA IMAGING PAC,"LUMEXA IMAGING, INC.",15000,3
Bill Cassidy,5,C00177436,UNUM GROUP POLITICAL ACTION COMMITTEE (UNUMPAC),UNUM GROUP,12500,7
Bill Cassidy,6,C00002881,TRUCKING POLITICAL ACTION COMMITTEE OF THE AMERICAN TRUCKING ASSOCIATIONS INC.,AMERICAN TRUCKING ASSOCIATIONS INC.,11700,15
Bill Cassidy,7,C00865865,DATAVANT PAC,DATAVANT,10500,3
Bill Cassidy,8,C00368696,RESPONSIBILITY AND FREEDOM WORK PAC (RFWPAC),WICKER VICTORY COMMITTEE,10000,2
Bill Cassidy,9,C00542027,BIG SKY OPPORTUNITY PAC,MONTANA RED,10000,2
Bill Cassidy,10,C00540054,NEBRASKA SANDHILLS PAC,FISCHER,10000,2
Bill Cassidy,11,C00035006,CHEVRON EMPLOYEES POLITICAL ACTION COMMITTEE - CHEVRON CORPORATION,CHEVRON CORPORATION,10000,3
Bill Cassidy,12,C00039578,THE COUNCIL OF INSURANCE AGENTS & BROKERS POLITICAL ACTION COMMITTEE,COUNCIL OF INSURANCE AGENTS & BROKERS,10000,3
Bill Cassidy,13,C00390674,FREEDOM FUND,,10000,2
Bill Cassidy,14,C00634774,COMMON SENSE FOR AMERICA PAC,KENNEDY,10000,2
Bill Cassidy,15,C00489302,SUNRUN INC POLITICAL ACTION COMMITTEE (SUNRUN PAC),SUNRUN INC.,10000,2
Bill Cassidy,16,C00296640,REPUBLICAN MAJORITY FUND,,10000,2
Bill Cassidy,17,C00455717,FREE STATE PAC,RED VICTORY 2022,10000,2
Bill Cassidy,18,C00413948,ARKANSAS FOR LEADERSHIP POLITICAL ACTION COMMITTEE (ARKPAC),BOOZMAN,10000,2
Bill Cassidy,19,C00398271,"ENVISION HEALTHCARE OPERATING, INC POLITICAL ACTION COMMITTEE","ENVISION HEALTHCARE OPERATING, INC",10000,2
Bill Cassidy,20,C00571323,TOGETHER HOLDING OUR MAJORITY PAC,NORTHEAST SENATE VICTORY COMMITTEE,10000,2
Blake Moore,1,C00797670,AMERICAN ISRAEL PUBLIC AFFAIRS COMMITTEE POLITICAL ACTION COMMITTEE,,14777,15
Blake Moore,2,C00563726,MR. SOUTHERN MISSOURIAN IN THE HOUSE PAC,SMITH VICTORY,10000,2
Blake Moore,3,C00284885,THE HOME DEPOT INC. POLITICAL ACTION COMMITTEE,THE HOME DEPOT INC.,10000,2
Blake Moore,4,C00828996,"HEALTHEQUITY, INC PURPLE POLITICAL ACTION COMMITTEE (HEALTHEQUITY PURPLE POLITICAL ACTION COMMITTEE)",,10000,2
Blake Moore,5,C00007880,"AMERICA'S CREDIT UNIONS PAC OF CREDIT UNION NATIONAL ASSOCIATION, INC.","CREDIT UNION NATIONAL ASSOCIATION, INC.",10000,4
Blake Moore,6,C00024968,AMERICAN OPTOMETRIC ASSOCIATION POLITICAL ACTION COMMITTEE,AMERICAN OPTOMETRIC ASSOCIATION,10000,5
Blake Moore,7,C00077321,AMERICAN INSTITUTE OF CERTIFIED PUBLIC ACCOUNTANTS POLITICAL ACTION COMMITTEE,AMERICAN INSTITUTE OF CERTIFIED PUBLIC ACCOUNTANTS,7500,3
Blake Moore,8,C00346353,"CRH AMERICAS, INC. PAC","CRH AMERICAS, INC.",7500,2
Blake Moore,9,C00107235,PRICEWATERHOUSECOOPERS POLITICAL ACTION COMMITTEE I,NONE,7000,3
Blake Moore,10,C00369751,"DELL TECHNOLOGIES, INC. POLITICAL ACTION COMMITTEE",,7000,4
Blake Moore,11,C00096156,HONEYWELL INTERNATIONAL POLITICAL ACTION COMMITTEE,HONEYWELL INTERNATIONAL,7000,3
Blake Moore,12,C00400929,"CENCORA, INC. PAC","CENCORA, INC.",7000,3
Blake Moore,13,C00433060,REPUBLICAN GOVERNANCE GROUP/TUESDAY GROUP PAC,NONE,6000,3
Blake Moore,14,C00343137,POLITICAL ACTION COMMITTEE OF THE AMERICAN ASSOCIATION OF ORTHOPAEDIC SURGEONS--PAC OF AAOS,AMERICAN ASSOCIATION OF ORTHOPAEDIC SURGEONS,6000,2
Blake Moore,15,C00106146,AMERICAN HOSPITAL ASSOCIATION PAC,AMERICAN HOSPITAL ASSOCIATION,6000,6
Blake Moore,16,C00104802,DELTA AIR LINES PAC,DELTA AIRLINES,6000,3
Blake Moore,17,C00161141,GUIDEWELL MUTUAL HOLDING CORPORATION POLITICAL ACTION COMMITTEE (GUIDEWELL PAC),,5500,3
Blake Moore,18,C00002972,NATIONAL RURAL ELECTRIC COOPERATIVE ASSOCIATION AMERICA'S ELECTRIC COOPERATIVES PAC,NATIONAL RURAL ELECTRIC COOPERATIVE ASSOCIATION (NRECA),5500,7
Blake Moore,19,C00366559,NRG ENERGY INC POLITICAL ACTION COMMITTEE,,5000,1
Blake Moore,20,C00589663,SYSCO CORPORATION GOOD GOVERNMENT COMMITTEE,SYSCO CORPORATION,5000,1
Brad Schneider,1,C00797670,AMERICAN ISRAEL PUBLIC AFFAIRS COMMITTEE POLITICAL ACTION COMMITTEE,,12702,16
Brad Schneider,2,C00828996,"HEALTHEQUITY, INC PURPLE POLITICAL ACTION COMMITTEE (HEALTHEQUITY PURPLE POLITICAL ACTION COMMITTEE)",,10000,2
Brad Schneider,3,C00227744,ERNST & YOUNG POLITICAL ACTION COMMITTEE,,10000,4
Brad Schneider,4,C00121319,THRIVENT FINANCIAL FOR LUTHERANS POLITICAL ACTION COMMITTEE,THRIVENT FINANCIAL FOR LUTHERANS,10000,2
Brad Schneider,5,C00406801,AVANGRID POLITICAL ACTION COMMITTEE,AVANGRID,10000,2
Brad Schneider,6,C00034157,AFLAC POLITICAL ACTION COMMITTEE (AFLAC PAC),AFLAC,7500,3
Brad Schneider,7,C00118943,MASSACHUSETTS MUTUAL LIFE INSURANCE COMPANY POLITICAL ACTION COMMITTEE,MASSACHUSETTS MUTUAL LIFE INSURANCE COMPANY,7500,2
Brad Schneider,8,C00035451,AIR LINE PILOTS ASSOCIATION PAC,AIR LINE PILOTS ASSOCIATION,7500,3
Brad Schneider,9,C00380550,FMR LLC POLITICAL ACTION COMMITTEE - FEDERAL (FIDELITY PAC),,7000,4
Brad Schneider,10,C00096156,HONEYWELL INTERNATIONAL POLITICAL ACTION COMMITTEE,HONEYWELL INTERNATIONAL,6000,4
Brad Schneider,11,C00141218,EXELON CORPORATION POLITICAL ACTION COMMITTEE,EXELON CORPORATION,6000,4
Brad Schneider,12,C00004812,MORTGAGE BANKERS ASSOCIATION POLITICAL ACTION COMMITTEE (MORPAC),MORTGAGE BANKERS ASSOCIATION,6000,3
Brad Schneider,13,C00171843,LIBERTY MUTUAL INSURANCE COMPANY - PAC,LIBERTY MUTUAL INSURANCE COMPANY,6000,3
Brad Schneider,14,C00105981,INVESTMENT COMPANY INSTITUTE POLITICAL ACTION COMMITTEE (ICI PAC),INVESTMENT COMPANY INSTITUTE,6000,3
Brad Schneider,15,C00147173,"WINE AND SPIRITS WHOLESALERS OF AMERICA, INC. POLITICAL ACTION COMMITTEE",WINE & SPIRITS WHOLESALERS OF AMERICA,5811,2
Brad Schneider,16,C00458257,EMPLOYEE OWNED S CORPORATIONS OF AMERICA PAC (ESCA PAC),EMPLOYEE OWNED S CORPORATIONS OF AMERICA,5500,2
Brad Schneider,17,C00082792,ELI LILLY AND COMPANY POLITICAL ACTION COMMITTEE,ELI LILLY AND COMPANY,5000,2
Brad Schneider,18,C00147066,AMERICAN COUNCIL OF LIFE INSURERS POLITICAL ACTION COMMITTEE,AMERICAN COUNCIL OF LIFE INSURERS,5000,2
Brad Schneider,19,C00145037,SOUTHERN COMPANY GAS EMPLOYEES PAC,,5000,1
Brad Schneider,20,C00142786,NIKE INC FEDERAL POLITICAL ACTION COMMITTEE (NIKE FEDERAL PAC),"NIKE, INC.",5000,1
Brendan Boyle,1,C00797670,AMERICAN ISRAEL PUBLIC AFFAIRS COMMITTEE POLITICAL ACTION COMMITTEE,,13750,6
Brendan Boyle,2,C00546119,SELECT MEDICAL CORPORATION PAC,SELECT MEDICAL CORPORATION,10000,2
Brendan Boyle,3,C00072025,NATIONAL RURAL LETTER CARRIERS' ASSOCIATION POLITICAL ACTION COMMITTEE,NATIONAL RURAL LETTER CARRIERS' ASSOCIATION,5000,1
Brendan Boyle,4,C00024521,AMERICAN ASSOCIATION FOR JUSTICE POLITICAL ACTION COMMITTEE (AAJ PAC),AMERICAN ASSOCIATION FOR JUSTICE (AAJ),5000,2
Brendan Boyle,5,C00227744,ERNST & YOUNG POLITICAL ACTION COMMITTEE,,5000,1
Brendan Boyle,6,C00028860,"AMERICAN FEDERATION OF TEACHERS, AFL-CIO COMMITTEE ON POLITICAL EDUCATION",,5000,1
Brendan Boyle,7,C00029447,INTERNATIONAL ASSOCIATION OF FIREFIGHTERS INTERESTED IN REGISTRATION AND EDUCATION PAC,INTERNATIONAL ASSOCIATION OF FIRE FIGHTERS,5000,2
Brendan Boyle,8,C00130773,NATIONAL MULTIFAMILY HOUSING COUNCIL AND REAL ESTATE TECHNOLOGY AND TRANSFORMATION CENTER POLITICAL ACTION COMMITTEE (NMHC PAC),NATIONAL MULTIFAMILY HOUSING COUNCIL,5000,1
Brendan Boyle,9,C00035675,BRISTOL-MYERS SQUIBB COMPANY POLITICAL ACTION COMMITTEE,BRISTOL-MYERS SQUIBB COMPANY,5000,1
Brendan Boyle,10,C00040998,NATIONAL AUTOMOBILE DEALERS ASSOCIATION POLITICAL ACTION COMMITTEE,NATIONAL AUTOMOBILE DEALERS ASSOCIATION,5000,1
Brendan Boyle,11,C00343137,POLITICAL ACTION COMMITTEE OF THE AMERICAN ASSOCIATION OF ORTHOPAEDIC SURGEONS--PAC OF AAOS,AMERICAN ASSOCIATION OF ORTHOPAEDIC SURGEONS,5000,1
Brendan Boyle,12,C00177436,UNUM GROUP POLITICAL ACTION COMMITTEE (UNUMPAC),UNUM GROUP,5000,1
Brendan Boyle,13,C00077321,AMERICAN INSTITUTE OF CERTIFIED PUBLIC ACCOUNTANTS POLITICAL ACTION COMMITTEE,AMERICAN INSTITUTE OF CERTIFIED PUBLIC ACCOUNTANTS,5000,2
Brendan Boyle,14,C00012476,UA UNION PLUMBERS & PIPEFITTERS VOTE! PAC (UNITED ASSOCIATION OF JOURNEYMEN AND APPRENTICES OF THE PLUMBING & PIPEFITTING INDUSTRY OF THE UNITED STATES AND CANADA),PLUMBERS & STEAMFITTERS LOCAL 22 PAC INC,5000,1
Brendan Boyle,15,C00484402,COUNTRY ROADS PAC,NONE,5000,1
Brendan Boyle,16,C00162818,INTERNATIONAL BROTHERHOOD OF ELECTRICAL WORKERS LOCAL 98 COMMITTEE ON POLITICAL EDUCATION,LOCAL 98 IBEW,5000,1
Brendan Boyle,17,C00447565,FINSECA PAC,,5000,3
Brendan Boyle,18,C00158881,NEW YORK LIFE INSURANCE COMPANY POLITICAL ACTION COMMITTEE,NEW YORK LIFE INSURANCE COMPANY,5000,2
Brendan Boyle,19,C00158576,INTERNATIONAL LONGSHOREMEN'S ASSOCIATION COMMITTEE ON POLITICAL EDUCATION,INTERNATIONAL LONGSHOREMEN'S ASSOCIATION,5000,1
Brendan Boyle,20,C00107235,PRICEWATERHOUSECOOPERS POLITICAL ACTION COMMITTEE I,NONE,5000,2
Brian Fitzpatrick,1,C00797670,AMERICAN ISRAEL PUBLIC AFFAIRS COMMITTEE POLITICAL ACTION COMMITTEE,,53180,34
Brian Fitzpatrick,2,C00817338,MVL PAC,,10000,2
Brian Fitzpatrick,3,C00236489,"KOCH, INC. POLITICAL ACTION COMMITTEE (KOCHPAC)","KOCH, INC.",10000,2
Brian Fitzpatrick,4,C00822833,DEFENDING THE AMERICAN DREAM PAC,,10000,2
Brian Fitzpatrick,5,C00008268,TRANSPORT WORKERS UNION OF AMERICA POLITICAL CONTRIBUTIONS COMMITTEE,TRANSPORT WORKERS UNION OF AMERICA,10000,2
Brian Fitzpatrick,6,C00403881,AMERICAN COLLEGE OF PHYSICIAN SERVICES INC PAC; AKA ACP SERVICES PAC,"AMERICAN COLLEGE OF PHYSICIAN SERVICES, INC",10000,2
Brian Fitzpatrick,7,C00697326,"ON WISCONSIN PAC, INC.",STEIL VICTORY FUND,10000,2
Brian Fitzpatrick,8,C00072025,NATIONAL RURAL LETTER CARRIERS' ASSOCIATION POLITICAL ACTION COMMITTEE,NATIONAL RURAL LETTER CARRIERS' ASSOCIATION,10000,2
Brian Fitzpatrick,9,C00013961,"SHEET METAL & AIR CONDITIONING CONTRACTORS' NATIONAL ASSOC., INC. POLITICAL ACTION COMMITTEE",,10000,6
Brian Fitzpatrick,10,C00029447,INTERNATIONAL ASSOCIATION OF FIREFIGHTERS INTERESTED IN REGISTRATION AND EDUCATION PAC,INTERNATIONAL ASSOCIATION OF FIRE FIGHTERS,10000,4
Brian Fitzpatrick,11,C00531764,A NEW NATION PAC,WAGNER VICTORY COMMITTEE,10000,2
Brian Fitzpatrick,12,C00683508,FOREVER YOUTH ORGANIZATION UTILIZING A NEW GENERATION PAC,KIM VICTORY FUND,10000,2
Brian Fitzpatrick,13,C00563726,MR. SOUTHERN MISSOURIAN IN THE HOUSE PAC,SMITH VICTORY,10000,2
Brian Fitzpatrick,14,C00639229,AMERICAN REVIVAL PAC,,10000,2
Brian Fitzpatrick,15,C00647354,TEAM AMERICA - BRINGING AMERICA TOGETHER PAC,,10000,2
Brian Fitzpatrick,16,C00002261,FEDERATION OF AMERICAN HOSPITALS PAC,FEDERATION OF AMERICAN HOSPITALS,10000,3
Brian Fitzpatrick,17,C00286807,PROFESSIONAL AVIATION SAFETY SPECIALISTS PAC,PROFESSIONAL AVIATION SAFETY SPECIALISTS,9000,4
Brian Fitzpatrick,18,C00004275,AMERICAN BANKERS ASSOCIATION PAC (BANKPAC),AMERICAN BANKERS ASSOCIATION (ABA),8500,3
Brian Fitzpatrick,19,C00238725,NATIONAL AIR TRAFFIC CONTROLLERS ASSOCIATION PAC,NATIONAL AIR TRAFFIC CONTROLLERS ASSOCIATION,8500,4
Brian Fitzpatrick,20,C00433060,REPUBLICAN GOVERNANCE GROUP/TUESDAY GROUP PAC,NONE,8000,7
Carol Miller,1,C00563726,MR. SOUTHERN MISSOURIAN IN THE HOUSE PAC,SMITH VICTORY,10000,2
Carol Miller,2,C00489336,WILD AND WONDERFUL PAC,CAPITO,10000,2
Carol Miller,3,C00777326,ALLIANCE FOR PHYSICAL THERAPY QUALITY AND INNOVATION INC PAC,,9000,2
Carol Miller,4,C00219444,NATIONAL STRUCTURED SETTLEMENTS TRADE ASSOCIATION PAC,NATIONAL STRUCTURED SETTLEMENTS TRADE ASSOCIATION,8000,5
Carol Miller,5,C00012880,AMERICAN PHYSICAL THERAPY ASSOCIATION PHYSICAL THERAPY POLITICAL ACTION COMMITTEE (PT-PAC),AMERICAN PHYSICAL THERAPY ASSOCIATION,7500,3
Carol Miller,6,C00379628,NUCOR CORPORATION POLITICAL ACTION COMMITTEE,NUCOR CORPORATION,7500,2
Carol Miller,7,C00797670,AMERICAN ISRAEL PUBLIC AFFAIRS COMMITTEE POLITICAL ACTION COMMITTEE,,6027,8
Carol Miller,8,C00008748,SEMPRA ENERGY EMPLOYEES POLITICAL ACTION COMMITTEE- FEDERAL,,6000,3
Carol Miller,9,C00363879,ENTERGY CORPORATION EMPLOYEE POLITICAL ACTION COMMITTEE (ENPAC),ENTERGY CORPORATION,6000,3
Carol Miller,10,C00347955,"LIFEPOINT HEALTH PAC - THE PAC OF LIFEPOINT CORPORATE SERVICES, GENERAL PARTNERSHIP (LCSGP) AND FACILITIES WHICH ARE SUBSIDIARIES OF LIFEPOINT HEALTH (COLLECTIVELY LIFEPOINT)","LIFEPOINT CORPORATE SERVICES, GENERAL PARTNERSHIP (LCSGP) AND FACILITIES WHICH ARE SUBSIDIARIES OF LIFEPOINT HEALTH (COLLECTIVELY LIFEPOINT)",5000,1
Carol Miller,11,C00197228,"ELEVANCE HEALTH, INC. POLITICAL ACTION COMMITTEE (ELEVANCE HEALTH PAC)","ELEVANCE HEALTH, INC.",5000,2
Carol Miller,12,C00496307,MARATHON PETROLEUM CORPORATION EMPLOYEES POLITICAL ACTION COMMITTEE (MPAC),MARATHON PETROLEUM CORPORATION,5000,1
Carol Miller,13,C00113811,NATIONAL ELECTRICAL CONTRACTORS ASSOCIATION POLITICAL ACTION COMMITTEE,NATIONAL ELECTRICAL CONTRACTORS ASSOCIATION,5000,2
Carol Miller,14,C00040998,NATIONAL AUTOMOBILE DEALERS ASSOCIATION POLITICAL ACTION COMMITTEE,NATIONAL AUTOMOBILE DEALERS ASSOCIATION,5000,1
Carol Miller,15,C00083535,DUKE ENERGY CORPORATION EMPLOYEE POLITICAL ACTION COMMITTEE (DUKEPAC),DUKE ENERGY CORPORATION,5000,2
Carol Miller,16,C00777458,DARLING INGREDIENTS INC POLITICAL ACTION COMMITTEE (DARPAC),DARLING INGREDIENTS INC.,5000,1
Carol Miller,17,C00486217,LPL FINANCIAL LLC POLITICAL ACTION COMMITTEE (LPL PAC),LPL FINANCIAL LLC,5000,3
Carol Miller,18,C00107235,PRICEWATERHOUSECOOPERS POLITICAL ACTION COMMITTEE I,NONE,5000,2
Carol Miller,19,C00431924,KIDNEY CARE PARTNERS POLITICAL ACTION COMMITTEE,NONE,5000,1
Carol Miller,20,C00105981,INVESTMENT COMPANY INSTITUTE POLITICAL ACTION COMMITTEE (ICI PAC),INVESTMENT COMPANY INSTITUTE,5000,2
Catherine Cortez Masto,1,C00202184,WATERPAC - NATIONAL RURAL WATER ASSOCIATION POLITICAL COMMITTEE,ARKANSAS RURAL WATER ASSOCIATION FEDERAL POLITICAL ACTION COMMITTEE,10000,2
Catherine Cortez Masto,2,C00448696,SENATE CONSERVATIVES FUND,NONE,7351,2
Catherine Cortez Masto,3,C00380550,FMR LLC POLITICAL ACTION COMMITTEE - FEDERAL (FIDELITY PAC),,6500,3
Catherine Cortez Masto,4,C00457754,U.S. TRAVEL ASSOCIATION PAC,U.S. TRAVEL ASSOCIATION,5000,1
Catherine Cortez Masto,5,C00540518,THE CAPITAL GROUP COMPANIES INC POLITICAL ACTION COMMITTEE,"THE CAPITAL GROUP COMPANIES, INC.",5000,1
Catherine Cortez Masto,6,C00206672,NEWMONT CORPORATION PAC (NEWPAC),,5000,1
Catherine Cortez Masto,7,C00424838,NOVO NORDISK INC. PAC (NOVO NORDISK PAC),,5000,1
Catherine Cortez Masto,8,C00105981,INVESTMENT COMPANY INSTITUTE POLITICAL ACTION COMMITTEE (ICI PAC),INVESTMENT COMPANY INSTITUTE,5000,1
Catherine Cortez Masto,9,C00067231,"HCA HEALTHCARE, INC. GOOD GOVERNMENT FUND","HCA HEALTHCARE, INC.",5000,1
Catherine Cortez Masto,10,C00332395,VIATRIS INC. POLITICAL ACTION COMMITTEE (VIAPAC),VIATRIS INC.,5000,1
Catherine Cortez Masto,11,C00401299,"FRESENIUS MEDICAL CARE HOLDINGS, INC. POLITICAL ACTION COMMITTEE","FRESENIUS MEDICAL CARE HOLDINGS, INC.",5000,1
Catherine Cortez Masto,12,C00059733,BROWN-FORMAN CORPORATION NON-PARTISAN COMMITTEE FOR RESPONSIBLE GOVERNMENT,BROWN-FORMAN CORPORATION,4999,2
Catherine Cortez Masto,13,C00468660,VERTEX PHARMACEUTICALS INCORPORATED POLITICAL ACTION COMMITTEE,VERTEX PHARMACEUTICALS INCORPORATED,4000,1
Catherine Cortez Masto,14,C00542365,"TOYOTA MOTOR NORTH AMERICA, INC POLITICAL ACTION COMMITTEE (TOYOTA/LEXUS PAC)","TOYOTA MOTOR NORTH AMERICA, INC",3500,2
Catherine Cortez Masto,15,C00515148,NORTHERN TRUST CORPORATION FEDERAL POLITICAL ACTION COMMITTEE (NORTHERN TRUST FEDERAL PAC),NORTHERN TRUST CORPORATION,3000,2
Catherine Cortez Masto,16,C00048579,SALT RIVER VALLEY WATER USERS' ASSOCIATION POLITICAL INVOLVEMENT COMMITTEE ( SRPPIC),SALT RIVER VALLEY WATER USERS' ASSOCIATION POLITICAL INVOLVEMENT COMMITTEE ( SRPPIC),3000,2
Catherine Cortez Masto,17,C00361741,INTUIT INC. 21ST CENTURY LEADERSHIP FUND,,2500,1
Catherine Cortez Masto,18,C00368142,OFFICE OF THE COMMISSIONER OF MAJOR LEAGUE BASEBALL POLITICAL ACTION COMMITTEE,OFFICE OF THE COMMISSIONER OF MAJOR LEAGUE BASEBALL,2500,1
Catherine Cortez Masto,19,C00360354,AMAZON.COM SERVICES LLC SEPARATE SEGREGATED FUND (AMAZON PAC),,2500,1
Catherine Cortez Masto,20,C00002972,NATIONAL RURAL ELECTRIC COOPERATIVE ASSOCIATION AMERICA'S ELECTRIC COOPERATIVES PAC,NATIONAL RURAL ELECTRIC COOPERATIVE ASSOCIATION (NRECA),2500,1
Chuck Grassley,1,C00331686,FASPAC FAREWAY STORES INC PAC,,5000,1
Chuck Grassley,2,C00342394,"EBAY INC-COMMITTEE FOR RESPONSIBLE INTERNET COMMERCE, (EBAY PAC)",,5000,1
Chuck Grassley,3,C00783167,WORKING FOR OHIO,VANCE,5000,1
Chuck Grassley,4,C00147066,AMERICAN COUNCIL OF LIFE INSURERS POLITICAL ACTION COMMITTEE,AMERICAN COUNCIL OF LIFE INSURERS,2500,1
Chuck Grassley,5,C00204099,DEERE & COMPANY PAC (AKA JOHN DEERE PAC),DEERE & COMPANY,2500,1
Chuck Grassley,6,C00210666,AMERICAN SPEECH-LANGUAGE-HEARING ASSOCIATION PAC (ASHA PAC),,2500,1
Chuck Grassley,7,C00402107,CUNA MUTUAL HOLDING COMPANY POLITICAL ACTION COMMITTEE/TRUSTAGE PAC,CUNA MUTUAL HOLDING COMPANY,2000,1
Chuck Grassley,8,C00074096,DOW INC. PAC (DOWPAC),DOW INC.,1000,1
Chuck Grassley,9,C00089086,"THE AMERICAN OCCUPATIONAL THERAPY ASSOCIATION, INC. POLITICAL ACTION COMMITTEE (AOTPAC)",,1000,1
Chuck Grassley,10,C00098061,TARGET CORPORATION CITIZENS POLITICAL FORUM (TARGETCITIZENS POLITICAL FORUM),TARGET CORPORATION,1000,1
Chuck Grassley,11,C00149104,CHS INC. POLITICAL ACTION COMMITTEE,,1000,1
Chuck Grassley,12,C00424218,ANYWHERE REAL ESTATE INC. PAC (ANYWHERE REAL ESTATE PAC),,1000,1
Chuck Grassley,13,C00507962,AES CORPORATION POLITICAL ACTION COMMITTEE; THE,AES CORPORATION,1000,1
Chuck Grassley,14,C00562546,NOVOCURE INC. PAC (A.K.A. NOVOCURE PAC),NOVOCURE INC.,1000,1
Chuck Grassley,15,C00760124,NATIONAL VICTORY ACTION FUND,,-8333,1
