member_name,rank,pac_cmte_id,pac_name,connected_org,total,count
Jason Smith,1,C00147066,AMERICAN COUNCIL OF LIFE INSURERS POLITICAL ACTION COMMITTEE,AMERICAN COUNCIL OF LIFE INSURERS,10000,2
Jason Smith,2,C00102764,AMERICAN CHIROPRACTIC ASSOCIATION POLITICAL ACTION COMMITTEE,AMERICAN CHIROPRACTIC ASSOCIATION,10000,3
Jason Smith,3,C00016683,PFIZER INC. PAC,PFIZER INC.,10000,3
Jason Smith,4,C00023028,NATIONAL COTTON COUNCIL OF AMERICA COMMITTEE FOR THE ADVANCEMENT OF COTTON,NATIONAL COTTON COUNCIL OF AMERICA,10000,2
Jason Smith,5,C00028787,NATIONAL CATTLEMEN'S BEEF ASSOCIATION POLITICAL ACTION COMMITTEE (NCBA-PAC),NATIONAL CATTLEMEN'S BEEF ASSOCIATION,10000,2
Jason Smith,6,C00433730,LYNN PAC,,10000,2
Jason Smith,7,C00432252,REGIONS FINANCIAL CORPORATION POLITICAL ACTION COMMITTEE,REGIONS FINANCIAL CORPORATION,10000,4
Jason Smith,8,C00428623,GOOGLE LLC NETPAC,GOOGLE LLC,10000,6
Jason Smith,9,C00039578,THE COUNCIL OF INSURANCE AGENTS & BROKERS POLITICAL ACTION COMMITTEE,COUNCIL OF INSURANCE AGENTS & BROKERS,10000,2
Jason Smith,10,C00397851,CENTENE CORPORATION POLITICAL ACTION COMMITTEE (CENTENE PAC),CENTENE CORPORATION POLITICAL ACTION COMMITTEE (CENTENE PAC),10000,3
Jason Smith,11,C00358663,AMERICAN RESORT DEVELOPMENT ASSOCIATION RESORT OWNERS COALITION PAC (ARDA-ROC PAC),AMERICAN RESORT DEVELOPMENT ASSOCIATION,10000,2
Jason Smith,12,C00010868,AMERICAN COUNCIL OF ENGINEERING COMPANIES (ACEC/PAC),AMERICAN COUNCIL OF ENGINEERING COMPANIES,10000,2
Jason Smith,13,C00488882,U.S. BANCORP FEDERAL POLITICAL ACTION COMMITTEE,U.S. BANCORP,10000,3
Jason Smith,14,C00340943,DAVITA INC. POLITICAL ACTION COMMITTEE (DAPAC),DAVITA INC.,10000,2
Jason Smith,15,C00104299,JPMORGAN CHASE & CO. FEDERAL POLITICAL ACTION COMMITTEE,JPMORGAN CHASE & CO.,10000,2
Jason Smith,16,C00204099,DEERE & COMPANY PAC (AKA JOHN DEERE PAC),DEERE & COMPANY,10000,2
Jason Smith,17,C00889568,"COUPANG, INC. COMPANY PAC (COUPAC)","COUPANG, INC.",10000,2
Jason Smith,18,C00193631,THE FARM CREDIT COUNCIL POLITICAL ACTION COMMITTEE,THE FARM CREDIT COUNCIL,10000,2
Jason Smith,19,C00002972,NATIONAL RURAL ELECTRIC COOPERATIVE ASSOCIATION AMERICA'S ELECTRIC COOPERATIVES PAC,NATIONAL RURAL ELECTRIC COOPERATIVE ASSOCIATION (NRECA),10000,2
Jason Smith,20,C00109546,VALERO ENERGY CORPORATION POLITICAL ACTION COMMITTEE,VALERO ENERGY CORPORATION,10000,2
Jimmy Gomez,1,C00797670,AMERICAN ISRAEL PUBLIC AFFAIRS COMMITTEE POLITICAL ACTION COMMITTEE,,25051,14
Jimmy Gomez,2,C00002766,UNITED FOOD AND COMMERCIAL WORKERS INTERNATIONAL UNION ACTIVE BALLOT CLUB,UNITED FOOD AND COMMERCIAL WORKERS INTERNATIONAL UNION,10000,2
Jimmy Gomez,3,C00110338,AMERICAN CRYSTAL SUGAR COMPANY POLITICAL ACTION COMMITTEE,AMERICAN CRYSTAL SUGAR COMPAY,10000,2
Jimmy Gomez,4,C00147173,"WINE AND SPIRITS WHOLESALERS OF AMERICA, INC. POLITICAL ACTION COMMITTEE",WINE & SPIRITS WHOLESALERS OF AMERICA,7500,4
Jimmy Gomez,5,C00105981,INVESTMENT COMPANY INSTITUTE POLITICAL ACTION COMMITTEE (ICI PAC),INVESTMENT COMPANY INSTITUTE,7500,3
Jimmy Gomez,6,C00415372,NATIONAL ASSOCIATION OF ENROLLED AGENTS POLITICAL ACTION COMMITTEE,NATIONAL ASSOCIATION OF ENROLLED AGENTS,6000,3
Jimmy Gomez,7,C00033779,THE REAL ESTATE ROUNDTABLE POLITICAL ACTION COMMITTEE (REALPAC),THE REAL ESTATE ROUNDTABLE,5000,2
Jimmy Gomez,8,C00617803,"JOBS, EDUCATION, & FAMILIES FIRST  JEFF PAC",JEFFRIES,5000,1
Jimmy Gomez,9,C00630285,OC JOBS & EDUCATION,,5000,2
Jimmy Gomez,10,C00271338,AMERIPAC: THE FUND FOR A GREATER AMERICA,HOYER,5000,1
Jimmy Gomez,11,C00219568,INTERNATIONAL UNION OF OPERATING ENGINEERS LOCAL NO. 12 FEDERAL PAC,INTERNATIONAL UNION OF OPERATING ENGINEERS LOCAL NO. 12,5000,1
Jimmy Gomez,12,C00651042,MOMS FED UP,,5000,1
Jimmy Gomez,13,C00028860,"AMERICAN FEDERATION OF TEACHERS, AFL-CIO COMMITTEE ON POLITICAL EDUCATION",,5000,1
Jimmy Gomez,14,C00127779,PRUDENTIAL FINANCIAL INC. FEDERAL POLITICAL ACTION COMMITTEE (AKA - PRUDENTIAL FEDERAL PAC),"PRUDENTIAL FINANCIAL, INC.",5000,2
Jimmy Gomez,15,C00130773,NATIONAL MULTIFAMILY HOUSING COUNCIL AND REAL ESTATE TECHNOLOGY AND TRANSFORMATION CENTER POLITICAL ACTION COMMITTEE (NMHC PAC),NATIONAL MULTIFAMILY HOUSING COUNCIL,5000,1
Jimmy Gomez,16,C00144766,NATIONAL BEER WHOLESALERS ASSOCIATION POLITICAL ACTION COMMITTEE,NATIONAL BEER WHOLESALERS ASSOCIATION,5000,2
Jimmy Gomez,17,C00029447,INTERNATIONAL ASSOCIATION OF FIREFIGHTERS INTERESTED IN REGISTRATION AND EDUCATION PAC,INTERNATIONAL ASSOCIATION OF FIRE FIGHTERS,5000,2
Jimmy Gomez,18,C00517235,TURQUOISE PAC,,5000,1
Jimmy Gomez,19,C00027342,INTERNATIONAL BROTHERHOOD OF ELECTRICAL WORKERS POLITICAL ACTION COMMITTEE,INTERNATIONAL BROTHERHOOD OF ELECTRICAL WORKERS,5000,1
Jimmy Gomez,20,C00545137,LEADERSHIP OPPORTUNITY INNOVATION SERVICE PAC,FRANKEL,5000,1
Jimmy Panetta,1,C00147173,"WINE AND SPIRITS WHOLESALERS OF AMERICA, INC. POLITICAL ACTION COMMITTEE",WINE & SPIRITS WHOLESALERS OF AMERICA,10000,2
Jimmy Panetta,2,C00110338,AMERICAN CRYSTAL SUGAR COMPANY POLITICAL ACTION COMMITTEE,AMERICAN CRYSTAL SUGAR COMPAY,10000,2
Jimmy Panetta,3,C00028787,NATIONAL CATTLEMEN'S BEEF ASSOCIATION POLITICAL ACTION COMMITTEE (NCBA-PAC),NATIONAL CATTLEMEN'S BEEF ASSOCIATION,10000,2
Jimmy Panetta,4,C00418897,VOTEVETS,,10000,4
Jimmy Panetta,5,C00828996,"HEALTHEQUITY, INC PURPLE POLITICAL ACTION COMMITTEE (HEALTHEQUITY PURPLE POLITICAL ACTION COMMITTEE)",,10000,2
Jimmy Panetta,6,C00280222,KPMG PARTNERS/PRINCIPALS AND EMPLOYEES PAC,NONE,10000,2
Jimmy Panetta,7,C00002238,NATIONAL COUNCIL OF FARMER COOPERATIVES CO-OP/PAC,NATIONAL COUNCIL OF FARMER COOPERATIVES,10000,3
Jimmy Panetta,8,C00227744,ERNST & YOUNG POLITICAL ACTION COMMITTEE,,10000,4
Jimmy Panetta,9,C00002972,NATIONAL RURAL ELECTRIC COOPERATIVE ASSOCIATION AMERICA'S ELECTRIC COOPERATIVES PAC,NATIONAL RURAL ELECTRIC COOPERATIVE ASSOCIATION (NRECA),7500,5
Jimmy Panetta,10,C00096156,HONEYWELL INTERNATIONAL POLITICAL ACTION COMMITTEE,HONEYWELL INTERNATIONAL,7500,6
Jimmy Panetta,11,C00358663,AMERICAN RESORT DEVELOPMENT ASSOCIATION RESORT OWNERS COALITION PAC (ARDA-ROC PAC),AMERICAN RESORT DEVELOPMENT ASSOCIATION,7500,2
Jimmy Panetta,12,C00447565,FINSECA PAC,,7500,3
Jimmy Panetta,13,C00004473,NATIONAL TELECOMMUNICATIONS COOPERATIVE ASSOCIATION RURAL BROADBAND PAC,NATIONAL TELECOMMUNICATIONS COOPERATIVE ASSOCIATION,7500,2
Jimmy Panetta,14,C00147066,AMERICAN COUNCIL OF LIFE INSURERS POLITICAL ACTION COMMITTEE,AMERICAN COUNCIL OF LIFE INSURERS,7500,3
Jimmy Panetta,15,C00107235,PRICEWATERHOUSECOOPERS POLITICAL ACTION COMMITTEE I,NONE,7500,3
Jimmy Panetta,16,C00007542,"INTERNATIONAL ASSOCIATION OF SHEET METAL, AIR, RAIL AND TRANSPORTATION WORKERS POLITICAL ACTION LEAGUE","INTERNATIONAL ASSOCIATION OF SHEET METAL, AIR, RAIL AND TRANSPORTATION WORKERS",7500,2
Jimmy Panetta,17,C00068692,FEDEX CORPORATION POLITICAL ACTION COMMITTEE,FEDEX CORPORATION,6500,4
Jimmy Panetta,18,C00142711,THE BOEING COMPANY PAC,THE BOEING COMPANY,6500,4
Jimmy Panetta,19,C00380550,FMR LLC POLITICAL ACTION COMMITTEE - FEDERAL (FIDELITY PAC),,6000,4
Jimmy Panetta,20,C00797670,AMERICAN ISRAEL PUBLIC AFFAIRS COMMITTEE POLITICAL ACTION COMMITTEE,,5504,8
Jodey Arrington,1,C00004275,AMERICAN BANKERS ASSOCIATION PAC (BANKPAC),AMERICAN BANKERS ASSOCIATION (ABA),10000,2
Jodey Arrington,2,C00109546,VALERO ENERGY CORPORATION POLITICAL ACTION COMMITTEE,VALERO ENERGY CORPORATION,10000,2
Jodey Arrington,3,C00219444,NATIONAL STRUCTURED SETTLEMENTS TRADE ASSOCIATION PAC,NATIONAL STRUCTURED SETTLEMENTS TRADE ASSOCIATION,10000,3
Jodey Arrington,4,C00369751,"DELL TECHNOLOGIES, INC. POLITICAL ACTION COMMITTEE",,10000,2
Jodey Arrington,5,C00199711,HEALTH CARE SERVICE CORPORATION EMPLOYEES' POLITICAL ACTION COMMITTEE,HEALTH CARE SERVICE CORPORATION,10000,2
Jodey Arrington,6,C00197228,"ELEVANCE HEALTH, INC. POLITICAL ACTION COMMITTEE (ELEVANCE HEALTH PAC)","ELEVANCE HEALTH, INC.",7500,3
Jodey Arrington,7,C00513549,PHILLIPS 66 PAC,PHILLIPS 66,7500,2
Jodey Arrington,8,C00499400,TRALAPAC (TRUCK RENTING AND LEASING ASSOCIATION PAC),TRUCK RENTING AND LEASING ASSOCIATION,5000,1
Jodey Arrington,9,C00135855,"DIAMONDBACK ENERGY, INC. POLITICAL ACTION COMMITTEE (DIAMONDBACK ENERGY PAC)",,5000,1
Jodey Arrington,10,C00227744,ERNST & YOUNG POLITICAL ACTION COMMITTEE,,5000,1
Jodey Arrington,11,C00226548,VISTRA EMPLOYEE POLITICAL ACTION COMMITTEE OF VISTRA CORP.,VISTRA CORP.,5000,3
Jodey Arrington,12,C00077321,AMERICAN INSTITUTE OF CERTIFIED PUBLIC ACCOUNTANTS POLITICAL ACTION COMMITTEE,AMERICAN INSTITUTE OF CERTIFIED PUBLIC ACCOUNTANTS,5000,1
Jodey Arrington,13,C00081414,"AMERICAN SUGAR CANE LEAGUE OF USA, INC PAC","AMERICAN SUGAR CANE LEAGUE OF USA, INC",5000,1
Jodey Arrington,14,C00496307,MARATHON PETROLEUM CORPORATION EMPLOYEES POLITICAL ACTION COMMITTEE (MPAC),MARATHON PETROLEUM CORPORATION,5000,1
Jodey Arrington,15,C00088591,EMPLOYEES OF NORTHROP GRUMMAN CORPORATION PAC,NORTHROP GRUMMAN CORPORATION,5000,2
Jodey Arrington,16,C00442905,GARNEY HOLDING CO. PAC,,5000,1
Jodey Arrington,17,C00503680,CROP INSURANCE PROFESSIONALS ASSOCIATION PAC-CIPA PAC,,5000,2
Jodey Arrington,18,C00415026,AMERICAN FUELS AND PETROCHEMICAL MANUFACTURERS ASSOCIATION POLITICAL ACTION COMMITTEE (AFPMPAC),AMERICAN FUELS AND PETROCHEMICAL MANUFACTURERS ASSOCIATION,5000,1
Jodey Arrington,19,C00503847,TEXAS CORN PAC OF THE TEXAS CORN PRODUCERS ASSOCIATION,NONE,5000,1
Jodey Arrington,20,C00106740,"AMERICA'S HEALTH INSURANCE PLANS, INC. PAC (AHIP PAC)","AMERICA'S HEALTH INSURANCE PLANS, INC.",5000,1
John Barrasso,1,C00041566,AMERICAN SOCIETY OF ASSOCIATION EXECUTIVES (ASAE) PAC,AMERICAN SOCIETY OF ASSOCIATION EXECUTIVES,10000,2
John Barrasso,2,C00110478,PEABODY ENERGY CORPORATION POLITICAL ACTION COMMITTEE  (PEABODY PAC),PEABODY ENERGY CORPORATION,5500,4
John Barrasso,3,C00483677,AMERICAN PETROLEUM INSTITUTE POLITICAL ACTION COMMITTEE (API PAC),,5000,1
John Barrasso,4,C00126763,NATIONAL ASSOCIATION OF CONVENIENCE STORES POLITICAL ACTION COMMITTEE,NATIONAL ASSOCIATION OF CONVENIENCE STORES,5000,1
John Barrasso,5,C00388470,EMERGENCY DEPARTMENT PRACTICE MANAGEMENT ASSOCIATION PAC (EDPMA-PAC),EMERGENCY DEPARTMENT PRACTICE MANAGEMENT ASSOCIATION PAC (EDPMA-PAC),5000,1
John Barrasso,6,C00279331,"CORE NATURAL RESOURCES, INC. (CORE PAC)","CORE NATURAL RESOURCES, INC.",5000,1
John Barrasso,7,C00557322,HESS CORPORATION POLITICAL ACTION COMMITTEE (HESS PAC),,5000,1
John Barrasso,8,C00074096,DOW INC. PAC (DOWPAC),DOW INC.,5000,1
John Barrasso,9,C00354753,DEVON ENERGY CORPORATION POLITICAL ACTION COMMITTEE (DEC PAC),DEVON ENERGY CORPORATION,5000,1
John Barrasso,10,C00426775,CHARTER COMMUNICATIONS INC. POLITICAL ACTION COMMITTEE,CHARTER COMMUNICATIONS INC.,5000,1
John Barrasso,11,C00109546,VALERO ENERGY CORPORATION POLITICAL ACTION COMMITTEE,VALERO ENERGY CORPORATION,5000,1
John Barrasso,12,C00574921,RYAN LLC POLITICAL ACTION COMMITTEE (RYANPAC),,5000,1
John Barrasso,13,C00346353,"CRH AMERICAS, INC. PAC","CRH AMERICAS, INC.",5000,1
John Barrasso,14,C00345793,RELX INC. POLITICAL ACTION COMMITTEE,RELX INC.,5000,1
John Barrasso,15,C00219642,"ENTERPRISE HOLDINGS, INC. / ENTERPRISE MOBILITY POLITICAL ACTION COMMITTEE","ENTERPRISE HOLDINGS, INC.",5000,1
John Barrasso,16,C00396895,GILEAD SCIENCES INC HEALTHCARE POLICY PAC,"GILEAD SCIENCES, INC.",5000,1
John Barrasso,17,C00336743,ASIAN AMERICAN HOTEL OWNERS ASSOCIATION PAC (AAHOA PAC),ASIAN AMERICAN HOTEL OWNERS ASSOCIATION,5000,1
John Barrasso,18,C00390583,"BHFS-E, PC PAC (BROWNSTEIN HYATT FARBER SCHRECK POLITICAL ACTION COMMITTEE)","BHFS-E, PC",4000,2
John Barrasso,19,C00502906,"META PLATFORMS, INC. PAC","META PLATFORMS, INC.",3500,2
John Barrasso,20,C00267849,ALLIED PILOTS ASSOCIATION POLITICAL ACTION COMMITTEE,,3000,2
John Cornyn,1,C00027466,NRSC,YOUNG VICTORY COMMITTEE,62000,1
John Cornyn,2,C00797670,AMERICAN ISRAEL PUBLIC AFFAIRS COMMITTEE POLITICAL ACTION COMMITTEE,,48416,25
John Cornyn,3,C00571323,TOGETHER HOLDING OUR MAJORITY PAC,NORTHEAST SENATE VICTORY COMMITTEE,10000,2
John Cornyn,4,C00567545,BOOTS POLITICAL ACTION COMMITTEE,MULLIN VICTORY FUND,10000,2
John Cornyn,5,C00566851,JOBS OPPORTUNITY AND NEW IDEAS PAC,,10000,2
John Cornyn,6,C00551853,OORAH! POLITICAL ACTION COMMITTEE,YOUNG VICTORY COMMITTEE,10000,2
John Cornyn,7,C00409276,MAKING A RESPONSIBLE STAND FOR HOUSEHOLDS IN AMERICA PAC,BLACKBURN,10000,2
John Cornyn,8,C00543207,BADLANDS PAC,TEAM CRAMER,10000,2
John Cornyn,9,C00022343,"INDEPENDENT INSURANCE AGENTS & BROKERS OF AMERICA, INC. POLITICAL ACTION COMMITTEE (INSURPAC)","INDEPENDENT INSURANCE AGENTS & BROKERS OF AMERICA, INC.",10000,2
John Cornyn,10,C00542027,BIG SKY OPPORTUNITY PAC,MONTANA RED,10000,2
John Cornyn,11,C00211524,TEXAS AND SOUTHWESTERN CATTLE RAISERS ASSOCIATION PAC,TEXAS AND SOUTHWESTERN CATTLE RAISERS ASSOCIATION,10000,2
John Cornyn,12,C00413948,ARKANSAS FOR LEADERSHIP POLITICAL ACTION COMMITTEE (ARKPAC),BOOZMAN,10000,2
John Cornyn,13,C00107235,PRICEWATERHOUSECOOPERS POLITICAL ACTION COMMITTEE I,NONE,10000,2
John Cornyn,14,C00227546,MICROSOFT CORPORATION STAKEHOLDERS VOLUNTARY PAC - MSVPAC,MICROSOFT CORPORATION,10000,2
John Cornyn,15,C00250399,AUTOMOTIVE FREE INTERNATIONAL TRADE PAC,NONE,10000,2
John Cornyn,16,C00236489,"KOCH, INC. POLITICAL ACTION COMMITTEE (KOCHPAC)","KOCH, INC.",10000,2
John Cornyn,17,C00035006,CHEVRON EMPLOYEES POLITICAL ACTION COMMITTEE - CHEVRON CORPORATION,CHEVRON CORPORATION,10000,2
John Cornyn,18,C00112896,CONOCOPHILLIPS SPIRIT PAC,CONOCOPHILLIPS,10000,2
John Cornyn,19,C00409003,HEARTLAND VALUES PAC,,10000,2
John Cornyn,20,C00001198,AMERICAN HOTEL AND LODGING ASSOCIATION POLITICAL ACTION COMMITTEE ('HOTELPAC'),,10000,2
John Larson,1,C00027342,INTERNATIONAL BROTHERHOOD OF ELECTRICAL WORKERS POLITICAL ACTION COMMITTEE,INTERNATIONAL BROTHERHOOD OF ELECTRICAL WORKERS,15000,5
John Larson,2,C00007542,"INTERNATIONAL ASSOCIATION OF SHEET METAL, AIR, RAIL AND TRANSPORTATION WORKERS POLITICAL ACTION LEAGUE","INTERNATIONAL ASSOCIATION OF SHEET METAL, AIR, RAIL AND TRANSPORTATION WORKERS",15000,3
John Larson,3,C00271338,AMERIPAC: THE FUND FOR A GREATER AMERICA,HOYER,10000,2
John Larson,4,C00406801,AVANGRID POLITICAL ACTION COMMITTEE,AVANGRID,10000,2
John Larson,5,C00401034,BUILDING FOUNDATIONS & LANDMARK OPPORTUNITIES PAC (BFLO PAC),,10000,2
John Larson,6,C00085316,THE CIGNA GROUP EMPLOYEE POLITICAL ACTION COMMITTEE,,10000,3
John Larson,7,C00077321,AMERICAN INSTITUTE OF CERTIFIED PUBLIC ACCOUNTANTS POLITICAL ACTION COMMITTEE,AMERICAN INSTITUTE OF CERTIFIED PUBLIC ACCOUNTANTS,10000,4
John Larson,8,C00110338,AMERICAN CRYSTAL SUGAR COMPANY POLITICAL ACTION COMMITTEE,AMERICAN CRYSTAL SUGAR COMPAY,10000,4
John Larson,9,C00303024,LOCKHEED MARTIN CORPORATION EMPLOYEES' POLITICAL ACTION COMMITTEE,LOCKHEED MARTIN CORPORATION,10000,2
John Larson,10,C00078451,GENERAL DYNAMICS CORPORATION POLITICAL ACTION COMMITTEE (GENERAL DYNAMICS EMPLOYEE PAC),GENERAL DYNAMICS CORPORATION,9500,4
John Larson,11,C00102764,AMERICAN CHIROPRACTIC ASSOCIATION POLITICAL ACTION COMMITTEE,AMERICAN CHIROPRACTIC ASSOCIATION,8500,4
John Larson,12,C00010868,AMERICAN COUNCIL OF ENGINEERING COMPANIES (ACEC/PAC),AMERICAN COUNCIL OF ENGINEERING COMPANIES,8000,4
John Larson,13,C00147066,AMERICAN COUNCIL OF LIFE INSURERS POLITICAL ACTION COMMITTEE,AMERICAN COUNCIL OF LIFE INSURERS,7500,3
John Larson,14,C00384818,CVS HEALTH PAC,CVS HEALTH,7500,2
John Larson,15,C00574970,FAIR SHOT PAC,,7000,2
John Larson,16,C00088591,EMPLOYEES OF NORTHROP GRUMMAN CORPORATION PAC,NORTHROP GRUMMAN CORPORATION,6000,4
John Larson,17,C00005249,NATIONAL ASSOCIATION OF INSURANCE AND FINANCIAL ADVISORS POLITICAL ACTION COMM,NATIONAL ASSOCIATION OF INSURANCE AND FINANCIAL ADVISORS,6000,2
John Larson,18,C00453290,CONNECTICUT ASSOCIATION OF OPTOMETRISTS INC PAC; THE,NONE,5000,2
John Larson,19,C00140061,NATIONAL EMERGENCY MEDICINE POLITICAL ACTION COMMITTEE / AMERICAN COLLEGE OF EMERGENCY PHYSICIANS,AMERICAN COLLEGE OF EMERGENCY PHYSICIANS,5000,3
John Larson,20,C00376376,"THE TRAVELERS COMPANIES, INC. POLITICAL ACTION COMMITTEE (T-PAC)",THE TRAVELERS COMPANIES INC.,5000,2
John Thune,1,C00001388,"DAIRY FARMERS OF AMERICA, INC. POLITICAL ACTION COMMITTEE; AKA DFA-PAC","DAIRY FARMERS OF AMERICA, INC.",10000,2
John Thune,2,C00186288,"VERIZON COMMUNICATIONS, INC. POLITICAL ACTION COMMITTEE (VERIZON PAC)",,10000,2
John Thune,3,C00503680,CROP INSURANCE PROFESSIONALS ASSOCIATION PAC-CIPA PAC,,10000,2
John Thune,4,C00029447,INTERNATIONAL ASSOCIATION OF FIREFIGHTERS INTERESTED IN REGISTRATION AND EDUCATION PAC,INTERNATIONAL ASSOCIATION OF FIRE FIGHTERS,10000,3
John Thune,5,C00426775,CHARTER COMMUNICATIONS INC. POLITICAL ACTION COMMITTEE,CHARTER COMMUNICATIONS INC.,10000,2
John Thune,6,C00112896,CONOCOPHILLIPS SPIRIT PAC,CONOCOPHILLIPS,10000,2
John Thune,7,C00332833,CARDINAL HEALTH INC. PAC,,10000,2
John Thune,8,C00193631,THE FARM CREDIT COUNCIL POLITICAL ACTION COMMITTEE,THE FARM CREDIT COUNCIL,10000,2
John Thune,9,C00830208,GE HEALTHCARE TECHNOLOGIES INC. PAC,,8500,2
John Thune,10,C00360008,NATIONAL THOROUGHBRED RACING ASSOCIATION POLITICAL ACTION COMMITTEE/HORSE PAC,NATIONAL THOROUGHBRED RACING ASSOCIATION,7500,2
John Thune,11,C00004812,MORTGAGE BANKERS ASSOCIATION POLITICAL ACTION COMMITTEE (MORPAC),MORTGAGE BANKERS ASSOCIATION,7000,1
John Thune,12,C00350744,"THE GOLDMAN SACHS GROUP, INC. POLITICAL ACTION COMMITTEE",THE GOLDMAN SACHS GROUP INC,5000,1
John Thune,13,C00363879,ENTERGY CORPORATION EMPLOYEE POLITICAL ACTION COMMITTEE (ENPAC),ENTERGY CORPORATION,5000,1
John Thune,14,C00342766,HF SINCLAIR POLITICAL ACTION COMMITTEE (DINO PAC),,5000,1
John Thune,15,C00340356,ADVANCED MEDICAL TECHNOLOGY ASSOCIATION POLITICAL ACTION COMMITTEE,ADVANCED MEDICAL TECHNOLOGY ASSOCIATION,5000,1
John Thune,16,C00337626,MORGAN STANLEY POLITICAL ACTION COMMITTEE,,5000,1
John Thune,17,C00336057,"ARRAY DIGITAL INFRASTRUCTURE, INC POLITICAL ACTION COMMITTEE",,5000,1
John Thune,18,C00345132,REPUBLICAN JEWISH COALITION POLITICAL ACTION COMMITTEE (RJC-PAC),REPUBLICAN JEWISH COALITION,5000,1
John Thune,19,C00321158,"SALEM MEDIA GROUP POLITICAL ACTION COMMITTEE, INC.","SALEM MEDIA GROUP, INC.",5000,1
John Thune,20,C00326389,AMALGAMATED SUGAR COMPANY POLITICAL ACTION COMMITTEE,AMALGAMATED SUGAR COMPANY,5000,1
Judy Chu,1,C00110338,AMERICAN CRYSTAL SUGAR COMPANY POLITICAL ACTION COMMITTEE,AMERICAN CRYSTAL SUGAR COMPAY,10000,2
Judy Chu,2,C00011114,AMERICAN FEDERATION OF STATE COUNTY & MUNICIPAL EMPLOYEES  P E O P L E,"AMERICAN FEDERATION OF STATE, COUNTY AND MUNICIPAL EMPLOYEES, AFL-CIO",7500,3
Judy Chu,3,C00005249,NATIONAL ASSOCIATION OF INSURANCE AND FINANCIAL ADVISORS POLITICAL ACTION COMM,NATIONAL ASSOCIATION OF INSURANCE AND FINANCIAL ADVISORS,6000,3
Judy Chu,4,C00028860,"AMERICAN FEDERATION OF TEACHERS, AFL-CIO COMMITTEE ON POLITICAL EDUCATION",,5000,1
Judy Chu,5,C00118943,MASSACHUSETTS MUTUAL LIFE INSURANCE COMPANY POLITICAL ACTION COMMITTEE,MASSACHUSETTS MUTUAL LIFE INSURANCE COMPANY,5000,2
Judy Chu,6,C00522094,PSYCHOLOGY PAC OF AMERICAN PSYCHOLOGICAL ASSOCIATION SERVICES INC.,AMERICAN PSYCHOLOGICAL ASSOCIATION SERVICES INC. (APASI),5000,1
Judy Chu,7,C00027342,INTERNATIONAL BROTHERHOOD OF ELECTRICAL WORKERS POLITICAL ACTION COMMITTEE,INTERNATIONAL BROTHERHOOD OF ELECTRICAL WORKERS,5000,1
Judy Chu,8,C00024521,AMERICAN ASSOCIATION FOR JUSTICE POLITICAL ACTION COMMITTEE (AAJ PAC),AMERICAN ASSOCIATION FOR JUSTICE (AAJ),5000,2
Judy Chu,9,C00227744,ERNST & YOUNG POLITICAL ACTION COMMITTEE,,5000,2
Judy Chu,10,C00023580,NATIONAL ASSOCIATION OF LETTER CARRIERS OF U.S.A. POLITICAL FUND (LETTER CARRIER POLITICAL FUND),BRANCH 193 NATIONAL ASSOCIATION OF LETTER CARRIERS POLITICAL ACTION COMMITTEE,5000,1
Judy Chu,11,C00107235,PRICEWATERHOUSECOOPERS POLITICAL ACTION COMMITTEE I,NONE,5000,2
Judy Chu,12,C00109991,SMALL BUSINESS INVESTOR ALLIANCE PAC,,5000,1
Judy Chu,13,C00415372,NATIONAL ASSOCIATION OF ENROLLED AGENTS POLITICAL ACTION COMMITTEE,NATIONAL ASSOCIATION OF ENROLLED AGENTS,5000,1
Judy Chu,14,C00211318,DELOITTE POLITICAL ACTION COMMITTEE,NONE,5000,2
Judy Chu,15,C00007542,"INTERNATIONAL ASSOCIATION OF SHEET METAL, AIR, RAIL AND TRANSPORTATION WORKERS POLITICAL ACTION LEAGUE","INTERNATIONAL ASSOCIATION OF SHEET METAL, AIR, RAIL AND TRANSPORTATION WORKERS",5000,1
Judy Chu,16,C00130773,NATIONAL MULTIFAMILY HOUSING COUNCIL AND REAL ESTATE TECHNOLOGY AND TRANSFORMATION CENTER POLITICAL ACTION COMMITTEE (NMHC PAC),NATIONAL MULTIFAMILY HOUSING COUNCIL,5000,2
Judy Chu,17,C00337626,MORGAN STANLEY POLITICAL ACTION COMMITTEE,,5000,2
Judy Chu,18,C00001016,CARPENTERS LEGISLATIVE IMPROVEMENT COMMITTEE UNITED BROTHERHOOD OF CARPENTERS AND JOINERS,UNITED BROTHERHOOD OF CARPENTERS AND JOINERS OF AMERICA,5000,2
Judy Chu,19,C00002469,MACHINISTS NON PARTISAN POLITICAL LEAGUE OF THE INTERNATIONAL ASSOCIATION OF MACHINISTS & AEROSPACE WORKERS,INTERNATIONAL ASSOCIATION OF MACHINISTS AND AEROSPACE WORKERS,5000,1
Judy Chu,20,C00685297,ELECT DEMOCRATIC WOMEN,PRO-CHOICE WOMEN,4500,6
Kevin Hern,1,C00797670,AMERICAN ISRAEL PUBLIC AFFAIRS COMMITTEE POLITICAL ACTION COMMITTEE,,41827,22
Kevin Hern,2,C00085316,THE CIGNA GROUP EMPLOYEE POLITICAL ACTION COMMITTEE,,10000,2
Kevin Hern,3,C00001198,AMERICAN HOTEL AND LODGING ASSOCIATION POLITICAL ACTION COMMITTEE ('HOTELPAC'),,7500,2
Kevin Hern,4,C00083857,OCCIDENTAL PETROLEUM CORPORATION POLITICAL ACTION COMMITTEE,,7500,3
Kevin Hern,5,C00110338,AMERICAN CRYSTAL SUGAR COMPANY POLITICAL ACTION COMMITTEE,AMERICAN CRYSTAL SUGAR COMPAY,7500,3
Kevin Hern,6,C00100321,"L3HARRIS TECHNOLOGIES, INC. PAC","L3HARRIS TECHNOLOGIES, INC.",7000,2
Kevin Hern,7,C00488262,NETJETS ASSOCIATION OF SHARED AIRCRAFT PILOTS PAC; NJASAP PAC,,6500,2
Kevin Hern,8,C00142711,THE BOEING COMPANY PAC,THE BOEING COMPANY,6500,6
Kevin Hern,9,C00126763,NATIONAL ASSOCIATION OF CONVENIENCE STORES POLITICAL ACTION COMMITTEE,NATIONAL ASSOCIATION OF CONVENIENCE STORES,6000,2
Kevin Hern,10,C00093054,WALMART INC. PAC FOR RESPONSIBLE GOVERNMENT,WALMART INC.,6000,4
Kevin Hern,11,C00227744,ERNST & YOUNG POLITICAL ACTION COMMITTEE,,5500,3
Kevin Hern,12,C00274431,UNITEDHEALTH GROUP INCORPORATED PAC (UNITEDHEALTH GROUP PAC),UNITEDHEALTH GROUP INCORPORATED,5000,1
Kevin Hern,13,C00066472,AMERICAN PROPERTY CASUALTY INSURANCE ASSOCIATION POLITICAL ACTION COMMITTEE (INSURING AMERICA PAC),AMERICAN PROPERTY CASUALTY INSURANCE ASSOCIATION,5000,1
Kevin Hern,14,C00078287,CNA FINANCIAL CORPORATION CITIZENS FOR GOOD GOVERNMENT,,5000,1
Kevin Hern,15,C00267849,ALLIED PILOTS ASSOCIATION POLITICAL ACTION COMMITTEE,,5000,2
Kevin Hern,16,C00251751,"LOWE'S COMPANIES, INC. POLITICAL ACTION COMMITTEE","LOWE'S COMPANIES, INC.",5000,2
Kevin Hern,17,C00740498,HANNOVER LIFE REASSURANCE COMPANY OF AMERICA PAC,HANNOVER LIFE REASSURANCE COMPANY OF AMERICA,5000,2
Kevin Hern,18,C00250399,AUTOMOTIVE FREE INTERNATIONAL TRADE PAC,NONE,5000,1
Kevin Hern,19,C00248716,COMCAST CORPORATION & NBCUNIVERSAL POLITICAL ACTION COMMITTEE - FEDERAL,COMCAST CORPORATION,5000,1
Kevin Hern,20,C00064766,"UNITED PARCEL SERVICE, INC. PAC (UPSPAC)","UNITED PARCEL SERVICE, INC.",5000,1
Linda Sanchez,1,C00077321,AMERICAN INSTITUTE OF CERTIFIED PUBLIC ACCOUNTANTS POLITICAL ACTION COMMITTEE,AMERICAN INSTITUTE OF CERTIFIED PUBLIC ACCOUNTANTS,10000,2
Linda Sanchez,2,C00546119,SELECT MEDICAL CORPORATION PAC,SELECT MEDICAL CORPORATION,10000,2
Linda Sanchez,3,C00002261,FEDERATION OF AMERICAN HOSPITALS PAC,FEDERATION OF AMERICAN HOSPITALS,10000,2
Linda Sanchez,4,C00110338,AMERICAN CRYSTAL SUGAR COMPANY POLITICAL ACTION COMMITTEE,AMERICAN CRYSTAL SUGAR COMPAY,10000,2
Linda Sanchez,5,C00024521,AMERICAN ASSOCIATION FOR JUSTICE POLITICAL ACTION COMMITTEE (AAJ PAC),AMERICAN ASSOCIATION FOR JUSTICE (AAJ),7500,3
Linda Sanchez,6,C00093054,WALMART INC. PAC FOR RESPONSIBLE GOVERNMENT,WALMART INC.,7500,4
Linda Sanchez,7,C00447565,FINSECA PAC,,6000,4
Linda Sanchez,8,C00678722,AMERICAN MEDICAL REHABILITATION PROVIDERS ASSOCIATION INC. PAC (AMRPA PAC),AMERICAN MEDICAL REHABILITATION PROVIDERS ASSOCIATION INC.,6000,2
Linda Sanchez,9,C00107235,PRICEWATERHOUSECOOPERS POLITICAL ACTION COMMITTEE I,NONE,5000,2
Linda Sanchez,10,C00303339,"NATIONAL ASSOCIATION OF REAL ESTATE INVESTMENT TRUSTS, INC. POLITICAL ACTION COMMITTEE","NATIONAL ASSOCIATION OF REAL ESTATE INVESTMENT TRUSTS, INC.",5000,1
Linda Sanchez,11,C00435990,MESSER CONSTRUCTION CO PAC,,5000,1
Linda Sanchez,12,C00426775,CHARTER COMMUNICATIONS INC. POLITICAL ACTION COMMITTEE,CHARTER COMMUNICATIONS INC.,5000,2
Linda Sanchez,13,C00326595,CAPITAL ONE FINANCIAL CORP. ASSOC. POLITICAL FUND,CAPITAL ONE FINANCIAL CORP.,5000,1
Linda Sanchez,14,C00085316,THE CIGNA GROUP EMPLOYEE POLITICAL ACTION COMMITTEE,,5000,3
Linda Sanchez,15,C00333104,THE AMERICAN SOCIETY OF PENSION PROFESSIONALS AND ACTUARIES POLITICAL ACTION COMMITTEE (ASPPA-NAPA PAC) A/K/A AMERICAN RETIREMENT ASSOCIATION POLITICAL ACTION COMMITTEE (ARA PAC),,5000,1
Linda Sanchez,16,C00337626,MORGAN STANLEY POLITICAL ACTION COMMITTEE,,5000,2
Linda Sanchez,17,C00431361,TEACHERS INSURANCE ANNUITY ASSOCIATION OF AMERICA PAC (TIAA PAC),,5000,2
Linda Sanchez,18,C00064766,"UNITED PARCEL SERVICE, INC. PAC (UPSPAC)","UNITED PARCEL SERVICE, INC.",5000,1
Linda Sanchez,19,C00300178,WELLS FARGO AND COMPANY EMPLOYEES GOOD GOVERNMENT FEDERAL FUND II,WELLS FARGO AND COMPANY,5000,2
Linda Sanchez,20,C00284885,THE HOME DEPOT INC. POLITICAL ACTION COMMITTEE,THE HOME DEPOT INC.,5000,2
Lloyd Doggett,1,C00011114,AMERICAN FEDERATION OF STATE COUNTY & MUNICIPAL EMPLOYEES  P E O P L E,"AMERICAN FEDERATION OF STATE, COUNTY AND MUNICIPAL EMPLOYEES, AFL-CIO",5000,2
Lloyd Doggett,2,C00007880,"AMERICA'S CREDIT UNIONS PAC OF CREDIT UNION NATIONAL ASSOCIATION, INC.","CREDIT UNION NATIONAL ASSOCIATION, INC.",5000,1
Lloyd Doggett,3,C00028860,"AMERICAN FEDERATION OF TEACHERS, AFL-CIO COMMITTEE ON POLITICAL EDUCATION",,5000,1
Lloyd Doggett,4,C00144766,NATIONAL BEER WHOLESALERS ASSOCIATION POLITICAL ACTION COMMITTEE,NATIONAL BEER WHOLESALERS ASSOCIATION,5000,1
Lloyd Doggett,5,C00027342,INTERNATIONAL BROTHERHOOD OF ELECTRICAL WORKERS POLITICAL ACTION COMMITTEE,INTERNATIONAL BROTHERHOOD OF ELECTRICAL WORKERS,5000,1
Lloyd Doggett,6,C00342907,MIDWEST REGION LABORERS' POLITICAL LEAGUE,"LABORERS' INTERNATIONAL UNION, MIDWEST REGION",5000,1
